{"$schema":"https://json-schema.org/draft/2020-12/schema","additionalProperties":false,"properties":{"attempt":{"const":1,"type":"integer"},"config":{"additionalProperties":false,"properties":{"ablation_changes":{"items":false,"maxItems":0,"minItems":0,"type":"array"},"benchmark_ref":{"additionalProperties":false,"properties":{"entity_id":{"const":"0ba2c621-786f-5de9-8535-aea4ac5a68ab","type":"string"},"hash_domain":{"const":"raw-bytes-sha256-v1","type":"string"},"owner":{"const":"F_RESEARCH","type":"string"},"revision_id":{"const":"f2793ac5-c691-5626-92fa-ed94693da7f2","type":"string"},"source_hash":{"const":"95c7c33346685ccf05c3fdd1a7e3c3c8403ab93d6ea5047782e4d624b0f500dc","type":"string"}},"required":["entity_id","revision_id","owner","hash_domain","source_hash"],"type":"object"},"block_length":{"const":null,"type":"null"},"budget_ref":{"additionalProperties":false,"properties":{"entity_id":{"const":"265a7216-4aee-5926-a310-c15725949b45","type":"string"},"hash_domain":{"const":"raw-bytes-sha256-v1","type":"string"},"owner":{"const":"F_RESEARCH","type":"string"},"revision_id":{"const":"4c84cda4-19c4-5689-83d8-77c68087b2a2","type":"string"},"source_hash":{"const":"63c16e02dc3c4ca9dd0f93849878637d759b2967d513b42bf7ab3c46f4f5b743","type":"string"}},"required":["entity_id","revision_id","owner","hash_domain","source_hash"],"type":"object"},"cost_policy_ref":{"additionalProperties":false,"properties":{"entity_id":{"const":"e991fd04-af47-5fc9-80f5-38a7da6ddd50","type":"string"},"hash_domain":{"const":"raw-bytes-sha256-v1","type":"string"},"owner":{"const":"F_RESEARCH","type":"string"},"revision_id":{"const":"abd66dbe-e1fc-572e-8b23-80c3359bb746","type":"string"},"source_hash":{"const":"28c7069bb6531185e6f4bcc6abeaa0232ab9740847eafd1d7049dd0a23f02187","type":"string"}},"required":["entity_id","revision_id","owner","hash_domain","source_hash"],"type":"object"},"execution_model_ref":{"additionalProperties":false,"properties":{"entity_id":{"const":"65859d2f-76a1-5c30-bff8-eb59d0dc7ed4","type":"string"},"hash_domain":{"const":"raw-bytes-sha256-v1","type":"string"},"owner":{"const":"F_RESEARCH","type":"string"},"revision_id":{"const":"ae9204f2-b98e-5cd5-b85b-7b9a33e60d75","type":"string"},"source_hash":{"const":"40232d20c2a399257fb4cf4a920b40c1e61b347f476136ae2c032024d514462f","type":"string"}},"required":["entity_id","revision_id","owner","hash_domain","source_hash"],"type":"object"},"fold_step_bars":{"const":null,"type":"null"},"mc_method":{"const":null,"type":"null"},"mc_runs":{"const":null,"type":"null"},"method":{"const":"SCENARIO","type":"string"},"optimization_space":{"items":false,"maxItems":0,"minItems":0,"type":"array"},"selection_policy_ref":{"additionalProperties":false,"properties":{"entity_id":{"const":"8edbdd11-1550-57fb-aa4e-f5104dae0f76","type":"string"},"hash_domain":{"const":"raw-bytes-sha256-v1","type":"string"},"owner":{"const":"F_RESEARCH","type":"string"},"revision_id":{"const":"ff97e367-998d-562c-aa07-4be9ad3fd8be","type":"string"},"source_hash":{"const":"0b41a13602f1c1ee16d452f36f3b066b654907a9f8114d205e3ffb5cc392ecb8","type":"string"}},"required":["entity_id","revision_id","owner","hash_domain","source_hash"],"type":"object"},"windows":{"items":false,"maxItems":1,"minItems":1,"prefixItems":[{"additionalProperties":false,"properties":{"embargo_bars":{"const":0,"type":"integer"},"purge_bars":{"const":0,"type":"integer"},"test_end":{"const":"2026-10-12T00:01:00Z","type":"string"},"test_start":{"const":"2026-10-12T00:00:00Z","type":"string"},"train_end":{"const":"2026-10-11T00:01:00Z","type":"string"},"train_start":{"const":"2026-10-11T00:00:00Z","type":"string"},"validation_end":{"const":null,"type":"null"},"validation_start":{"const":null,"type":"null"}},"required":["train_start","train_end","validation_start","validation_end","test_start","test_end","purge_bars","embargo_bars"],"type":"object"}],"type":"array"}},"required":["method","windows","fold_step_bars","optimization_space","selection_policy_ref","cost_policy_ref","execution_model_ref","benchmark_ref","ablation_changes","mc_method","mc_runs","block_length","budget_ref"],"type":"object"},"determinism_level":{"const":"BITWISE","type":"string"},"failures":{"items":false,"maxItems":0,"minItems":0,"type":"array"},"method_ref":{"additionalProperties":false,"properties":{"entity_id":{"const":"2c46876b-1d28-5b24-9271-c81df3ef3bf6","type":"string"},"hash_domain":{"const":"raw-bytes-sha256-v1","type":"string"},"owner":{"const":"F_RESEARCH","type":"string"},"revision_id":{"const":"11209473-fe6e-5c46-8e74-0a0ca98bc7d0","type":"string"},"source_hash":{"const":"b4f081281382c956defccb005a3b767589a2c8556852a94b9b6726fecdfbd17c","type":"string"}},"required":["entity_id","revision_id","owner","hash_domain","source_hash"],"type":"object"},"result_refs":{"items":false,"maxItems":0,"minItems":0,"type":"array"},"seed":{"const":17,"type":"integer"},"snapshot_ref":{"additionalProperties":false,"properties":{"entity_id":{"const":"a77b9d10-2047-5d52-8b6e-30e20d12a4f4","type":"string"},"hash_domain":{"const":"raw-bytes-sha256-v1","type":"string"},"owner":{"const":"F_RESEARCH","type":"string"},"revision_id":{"const":"96d57a7f-5f37-5aec-a032-fdf7e9a7caec","type":"string"},"source_hash":{"const":"04f41735b801ad365974dca7038d81f69b2565b8b73d95b8b7af9afbf1294566","type":"string"}},"required":["entity_id","hash_domain","owner","revision_id","source_hash"],"type":"object"},"status":{"const":"QUEUED","type":"string"}},"required":["snapshot_ref","method_ref","config","seed","attempt","status","result_refs","failures","determinism_level"],"type":"object"}