{"attempt":1,"config":{"ablation_changes":[],"benchmark_ref":{"entity_id":"0ba2c621-786f-5de9-8535-aea4ac5a68ab","hash_domain":"raw-bytes-sha256-v1","owner":"F_RESEARCH","revision_id":"f2793ac5-c691-5626-92fa-ed94693da7f2","source_hash":"95c7c33346685ccf05c3fdd1a7e3c3c8403ab93d6ea5047782e4d624b0f500dc"},"block_length":null,"budget_ref":{"entity_id":"265a7216-4aee-5926-a310-c15725949b45","hash_domain":"raw-bytes-sha256-v1","owner":"F_RESEARCH","revision_id":"4c84cda4-19c4-5689-83d8-77c68087b2a2","source_hash":"63c16e02dc3c4ca9dd0f93849878637d759b2967d513b42bf7ab3c46f4f5b743"},"cost_policy_ref":{"entity_id":"e991fd04-af47-5fc9-80f5-38a7da6ddd50","hash_domain":"raw-bytes-sha256-v1","owner":"F_RESEARCH","revision_id":"abd66dbe-e1fc-572e-8b23-80c3359bb746","source_hash":"28c7069bb6531185e6f4bcc6abeaa0232ab9740847eafd1d7049dd0a23f02187"},"execution_model_ref":{"entity_id":"65859d2f-76a1-5c30-bff8-eb59d0dc7ed4","hash_domain":"raw-bytes-sha256-v1","owner":"F_RESEARCH","revision_id":"ae9204f2-b98e-5cd5-b85b-7b9a33e60d75","source_hash":"40232d20c2a399257fb4cf4a920b40c1e61b347f476136ae2c032024d514462f"},"fold_step_bars":null,"mc_method":null,"mc_runs":null,"method":"SCENARIO","optimization_space":[],"selection_policy_ref":{"entity_id":"8edbdd11-1550-57fb-aa4e-f5104dae0f76","hash_domain":"raw-bytes-sha256-v1","owner":"F_RESEARCH","revision_id":"ff97e367-998d-562c-aa07-4be9ad3fd8be","source_hash":"0b41a13602f1c1ee16d452f36f3b066b654907a9f8114d205e3ffb5cc392ecb8"},"windows":[{"embargo_bars":0,"purge_bars":0,"test_end":"2026-10-12T00:01:00Z","test_start":"2026-10-12T00:00:00Z","train_end":"2026-10-11T00:01:00Z","train_start":"2026-10-11T00:00:00Z","validation_end":null,"validation_start":null}]},"determinism_level":"BITWISE","failures":[],"method_ref":{"entity_id":"2c46876b-1d28-5b24-9271-c81df3ef3bf6","hash_domain":"raw-bytes-sha256-v1","owner":"F_RESEARCH","revision_id":"11209473-fe6e-5c46-8e74-0a0ca98bc7d0","source_hash":"b4f081281382c956defccb005a3b767589a2c8556852a94b9b6726fecdfbd17c"},"result_refs":[],"seed":17,"snapshot_ref":{"entity_id":"a77b9d10-2047-5d52-8b6e-30e20d12a4f4","hash_domain":"raw-bytes-sha256-v1","owner":"F_RESEARCH","revision_id":"96d57a7f-5f37-5aec-a032-fdf7e9a7caec","source_hash":"04f41735b801ad365974dca7038d81f69b2565b8b73d95b8b7af9afbf1294566"},"status":"QUEUED"}